{
    "envelope": {
        "spec_tag": "v0.1.0",
        "graph_version": "2022-08-23",
        "evaluator_version": "0.1.0",
        "evaluation_time": "2026-04-15T10:00:00Z",
        "patient_fingerprint": "2a95262269d11772673559bb46fe4dfd6aeb6c5fdc30348c420686c29a3b4f9b",
        "started_at": "2026-04-23T16:21:33.338110Z",
        "completed_at": "2026-04-23T16:21:33.338323Z"
    },
    "events": [
        {
            "seq": 1,
            "type": "evaluation_started",
            "guideline_id": null,
            "patient_age_years": 35,
            "patient_sex": "male",
            "guidelines_in_scope": [
                "guideline:acc-aha-cholesterol-2018",
                "guideline:ada-diabetes-2024",
                "guideline:kdigo-ckd-2024",
                "guideline:uspstf-statin-2022"
            ]
        },
        {
            "seq": 2,
            "type": "guideline_entered",
            "guideline_id": "guideline:acc-aha-cholesterol-2018",
            "guideline_title": "2018 AHA/ACC Guideline on the Management of Blood Cholesterol"
        },
        {
            "seq": 3,
            "type": "recommendation_considered",
            "guideline_id": "guideline:acc-aha-cholesterol-2018",
            "recommendation_id": "rec:accaha-statin-diabetes",
            "recommendation_title": "Moderate-intensity statin for diabetes mellitus, age 40-75",
            "evidence_grade": "COR I, LOE A",
            "intent": "primary_prevention",
            "trigger": "patient_state"
        },
        {
            "seq": 4,
            "type": "eligibility_evaluation_started",
            "guideline_id": "guideline:acc-aha-cholesterol-2018",
            "recommendation_id": "rec:accaha-statin-diabetes"
        },
        {
            "seq": 5,
            "type": "predicate_evaluated",
            "guideline_id": "guideline:acc-aha-cholesterol-2018",
            "recommendation_id": "rec:accaha-statin-diabetes",
            "path": [
                "all_of",
                0
            ],
            "predicate": "age_between",
            "args": {
                "min": 40,
                "max": 75
            },
            "inputs_read": [
                {
                    "source": "patient.demographics",
                    "locator": "patient.date_of_birth",
                    "value": "1990-09-21",
                    "present": true
                },
                {
                    "source": "derived",
                    "locator": "evaluation_time",
                    "value": "2026-04-15T10:00:00Z",
                    "present": true
                }
            ],
            "result": "false",
            "missing_data_policy_applied": null,
            "note": null
        },
        {
            "seq": 6,
            "type": "composite_resolved",
            "guideline_id": "guideline:acc-aha-cholesterol-2018",
            "recommendation_id": "rec:accaha-statin-diabetes",
            "path": [
                "all_of"
            ],
            "operator": "all_of",
            "result": "false",
            "short_circuited": true
        },
        {
            "seq": 7,
            "type": "eligibility_evaluation_completed",
            "guideline_id": "guideline:acc-aha-cholesterol-2018",
            "recommendation_id": "rec:accaha-statin-diabetes",
            "result": "ineligible",
            "final_value": "false"
        },
        {
            "seq": 8,
            "type": "recommendation_considered",
            "guideline_id": "guideline:acc-aha-cholesterol-2018",
            "recommendation_id": "rec:accaha-statin-primary-prevention",
            "recommendation_title": "Moderate-to-high-intensity statin for primary prevention (age 40-75, LDL 70-189, ASCVD risk \u22657.5%)",
            "evidence_grade": "COR I, LOE A",
            "intent": "primary_prevention",
            "trigger": "patient_state"
        },
        {
            "seq": 9,
            "type": "eligibility_evaluation_started",
            "guideline_id": "guideline:acc-aha-cholesterol-2018",
            "recommendation_id": "rec:accaha-statin-primary-prevention"
        },
        {
            "seq": 10,
            "type": "risk_score_lookup",
            "guideline_id": "guideline:acc-aha-cholesterol-2018",
            "score_name": "ascvd_10yr",
            "resolution": "unavailable",
            "supplied_value": null,
            "supplied_computed_date": null,
            "inputs_read": [],
            "computed_value": null,
            "method": null,
            "note": "Risk score not supplied in patient context; v0 does not compute ASCVD via PCE."
        },
        {
            "seq": 11,
            "type": "predicate_evaluated",
            "guideline_id": "guideline:acc-aha-cholesterol-2018",
            "recommendation_id": "rec:accaha-statin-primary-prevention",
            "path": [
                "all_of",
                0
            ],
            "predicate": "age_between",
            "args": {
                "min": 40,
                "max": 75
            },
            "inputs_read": [
                {
                    "source": "patient.demographics",
                    "locator": "patient.date_of_birth",
                    "value": "1990-09-21",
                    "present": true
                },
                {
                    "source": "derived",
                    "locator": "evaluation_time",
                    "value": "2026-04-15T10:00:00Z",
                    "present": true
                }
            ],
            "result": "false",
            "missing_data_policy_applied": null,
            "note": null
        },
        {
            "seq": 12,
            "type": "composite_resolved",
            "guideline_id": "guideline:acc-aha-cholesterol-2018",
            "recommendation_id": "rec:accaha-statin-primary-prevention",
            "path": [
                "all_of"
            ],
            "operator": "all_of",
            "result": "false",
            "short_circuited": true
        },
        {
            "seq": 13,
            "type": "eligibility_evaluation_completed",
            "guideline_id": "guideline:acc-aha-cholesterol-2018",
            "recommendation_id": "rec:accaha-statin-primary-prevention",
            "result": "ineligible",
            "final_value": "false"
        },
        {
            "seq": 14,
            "type": "recommendation_considered",
            "guideline_id": "guideline:acc-aha-cholesterol-2018",
            "recommendation_id": "rec:accaha-statin-secondary-prevention",
            "recommendation_title": "High-intensity statin for secondary prevention in clinical ASCVD (age \u226475)",
            "evidence_grade": "COR I, LOE A",
            "intent": "treatment",
            "trigger": "patient_state"
        },
        {
            "seq": 15,
            "type": "eligibility_evaluation_started",
            "guideline_id": "guideline:acc-aha-cholesterol-2018",
            "recommendation_id": "rec:accaha-statin-secondary-prevention"
        },
        {
            "seq": 16,
            "type": "predicate_evaluated",
            "guideline_id": "guideline:acc-aha-cholesterol-2018",
            "recommendation_id": "rec:accaha-statin-secondary-prevention",
            "path": [
                "all_of",
                0
            ],
            "predicate": "has_active_condition",
            "args": {
                "codes": [
                    "cond:ascvd-established"
                ]
            },
            "inputs_read": [
                {
                    "source": "patient.conditions",
                    "locator": "conditions[]",
                    "value": null,
                    "present": true
                }
            ],
            "result": "false",
            "missing_data_policy_applied": null,
            "note": null
        },
        {
            "seq": 17,
            "type": "composite_resolved",
            "guideline_id": "guideline:acc-aha-cholesterol-2018",
            "recommendation_id": "rec:accaha-statin-secondary-prevention",
            "path": [
                "all_of"
            ],
            "operator": "all_of",
            "result": "false",
            "short_circuited": true
        },
        {
            "seq": 18,
            "type": "eligibility_evaluation_completed",
            "guideline_id": "guideline:acc-aha-cholesterol-2018",
            "recommendation_id": "rec:accaha-statin-secondary-prevention",
            "result": "ineligible",
            "final_value": "false"
        },
        {
            "seq": 19,
            "type": "recommendation_considered",
            "guideline_id": "guideline:acc-aha-cholesterol-2018",
            "recommendation_id": "rec:accaha-statin-severe-hypercholesterolemia",
            "recommendation_title": "High-intensity statin for severe hypercholesterolemia (LDL \u2265190, age 20-75)",
            "evidence_grade": "COR I, LOE B-NR",
            "intent": "treatment",
            "trigger": "patient_state"
        },
        {
            "seq": 20,
            "type": "eligibility_evaluation_started",
            "guideline_id": "guideline:acc-aha-cholesterol-2018",
            "recommendation_id": "rec:accaha-statin-severe-hypercholesterolemia"
        },
        {
            "seq": 21,
            "type": "predicate_evaluated",
            "guideline_id": "guideline:acc-aha-cholesterol-2018",
            "recommendation_id": "rec:accaha-statin-severe-hypercholesterolemia",
            "path": [
                "all_of",
                0
            ],
            "predicate": "age_between",
            "args": {
                "min": 20,
                "max": 75
            },
            "inputs_read": [
                {
                    "source": "patient.demographics",
                    "locator": "patient.date_of_birth",